{
  "name": "breadcrumb",
  "category": "navigation",
  "status": "stable",
  "kind": "custom-element",
  "tagName": "blora-breadcrumb",
  "since": "2.0.0",
  "requiresJavaScript": true,
  "formAssociated": false,
  "attributes": {},
  "properties": {},
  "methods": {},
  "events": {},
  "slots": {
    "default": "Declarative <blora-breadcrumb-item label href current> definitions; consumed into the official navigation tree."
  },
  "parts": [],
  "cssProperties": [],
  "accessibilityPattern": "navigation"
}
