{
  "name": "spinner",
  "category": "feedback",
  "status": "stable",
  "kind": "css-only",
  "since": "2.0.0",
  "requiresJavaScript": false,
  "formAssociated": false,
  "attributes": {},
  "properties": {},
  "methods": {},
  "events": {},
  "slots": {
    "default": "Content"
  },
  "parts": [],
  "cssProperties": [],
  "accessibilityPattern": "input",
  "migrationFromV1": "spinner.migration.md"
}
