{
  "name": "timeline",
  "category": "data-display",
  "status": "stable",
  "kind": "custom-element",
  "tagName": "blora-timeline",
  "since": "2.0.0",
  "requiresJavaScript": true,
  "formAssociated": false,
  "attributes": {},
  "properties": {},
  "methods": {},
  "events": {},
  "slots": {
    "default": "Declarative <blora-timeline-item time title description variant> definitions; consumed into the official list tree."
  },
  "parts": [],
  "cssProperties": [],
  "accessibilityPattern": "list",
  "migrationFromV1": "timeline.migration.md"
}
