{
  "$schema": "../../schemas/component-contract.schema.json",
  "name": "fab",
  "category": "actions",
  "status": "beta",
  "kind": "css-only",
  "since": "2.0.0",
  "requiresJavaScript": false,
  "formAssociated": false,
  "attributes": {
    "data-variant": {
      "type": "\"primary\" | \"surface\"",
      "default": "primary",
      "reflects": true
    }
  },
  "properties": {},
  "methods": {},
  "events": {},
  "slots": {
    "default": "Content"
  },
  "parts": [],
  "cssProperties": [],
  "accessibilityPattern": "section",
  "migrationFromV1": "fab.migration.md"
}
